{
  "meta": {
    "project": "English Word Elements",
    "repository": "00-english-word-elements",
    "schemaVersion": 1,
    "dataVersion": "0.1.0",
    "language": "en",
    "interfaceLanguages": [
      "ko",
      "en"
    ],
    "updatedAt": "2026-10-07",
    "noticeKo": "현재 데이터는 구조와 검색 기능을 검증하기 위한 초기 검수 샘플입니다."
  },
  "sources": [
    {
      "id": "src-oewn",
      "name": "Open English WordNet",
      "url": "https://en-word.net/",
      "license": "CC BY 4.0",
      "role": "lemma, part of speech, English gloss and lexical relations"
    },
    {
      "id": "src-wiktionary",
      "name": "English Wiktionary",
      "url": "https://en.wiktionary.org/",
      "license": "CC BY-SA 4.0 / GFDL",
      "role": "etymology, forms, affixes and derived terms"
    },
    {
      "id": "src-editorial",
      "name": "English Word Elements editorial analysis",
      "url": "https://github.com/shynewsky/00-english-word-elements",
      "license": "CC BY-SA 4.0",
      "role": "Korean glosses, pedagogical segmentation and sense linking"
    }
  ],
  "concepts": [
    {
      "id": "concept-negation",
      "labels": {
        "ko": [
          "부정",
          "아님",
          "반대"
        ],
        "en": [
          "negation",
          "not",
          "opposite"
        ]
      },
      "descriptionKo": "어떤 성질이나 상태가 아님을 나타냄"
    },
    {
      "id": "concept-belief",
      "labels": {
        "ko": [
          "믿다",
          "믿음",
          "신뢰"
        ],
        "en": [
          "believe",
          "belief",
          "trust"
        ]
      },
      "descriptionKo": "사실이라고 받아들이거나 신뢰하는 것"
    },
    {
      "id": "concept-state",
      "labels": {
        "ko": [
          "상태",
          "성질",
          "됨"
        ],
        "en": [
          "state",
          "quality",
          "condition"
        ]
      },
      "descriptionKo": "상태나 성질을 나타냄"
    },
    {
      "id": "concept-writing",
      "labels": {
        "ko": [
          "쓰다",
          "기록하다",
          "글"
        ],
        "en": [
          "write",
          "record",
          "writing"
        ]
      },
      "descriptionKo": "글이나 기호로 기록하는 것"
    },
    {
      "id": "concept-carrying",
      "labels": {
        "ko": [
          "나르다",
          "운반하다",
          "지니다"
        ],
        "en": [
          "carry",
          "transport",
          "bear"
        ]
      },
      "descriptionKo": "무언가를 옮기거나 지니는 것"
    },
    {
      "id": "concept-crossing",
      "labels": {
        "ko": [
          "가로질러",
          "건너",
          "횡단"
        ],
        "en": [
          "across",
          "through",
          "beyond"
        ]
      },
      "descriptionKo": "한쪽에서 다른 쪽으로 건너는 것"
    },
    {
      "id": "concept-life",
      "labels": {
        "ko": [
          "생명",
          "생물",
          "삶"
        ],
        "en": [
          "life",
          "living",
          "biology"
        ]
      },
      "descriptionKo": "생명과 살아 있는 존재"
    },
    {
      "id": "concept-study",
      "labels": {
        "ko": [
          "학문",
          "연구",
          "학설"
        ],
        "en": [
          "study",
          "science",
          "field of study"
        ]
      },
      "descriptionKo": "체계적인 학문이나 연구 분야"
    },
    {
      "id": "concept-possibility",
      "labels": {
        "ko": [
          "가능",
          "할 수 있음",
          "능력"
        ],
        "en": [
          "possible",
          "capable",
          "able"
        ]
      },
      "descriptionKo": "어떤 일을 할 수 있는 상태"
    },
    {
      "id": "concept-agent",
      "labels": {
        "ko": [
          "행위자",
          "사람",
          "하는 사람"
        ],
        "en": [
          "agent",
          "person who",
          "one who"
        ]
      },
      "descriptionKo": "행동을 하는 사람이나 도구"
    },
    {
      "id": "concept-inside",
      "labels": {
        "ko": [
          "안으로",
          "내부",
          "안에"
        ],
        "en": [
          "in",
          "into",
          "inside"
        ]
      },
      "descriptionKo": "내부로 향하거나 내부에 있는 것"
    },
    {
      "id": "concept-action",
      "labels": {
        "ko": [
          "행위",
          "과정",
          "결과"
        ],
        "en": [
          "action",
          "process",
          "result"
        ]
      },
      "descriptionKo": "행동, 과정 또는 그 결과"
    },
    {
      "id": "concept-before",
      "labels": {
        "ko": [
          "이전",
          "미리",
          "앞"
        ],
        "en": [
          "before",
          "in advance",
          "earlier"
        ]
      },
      "descriptionKo": "시간이나 순서가 앞섬"
    },
    {
      "id": "concept-again",
      "labels": {
        "ko": [
          "다시",
          "반복"
        ],
        "en": [
          "again",
          "back",
          "repeat"
        ]
      },
      "descriptionKo": "행동을 다시 하거나 되돌림"
    }
  ],
  "elements": [
    {
      "id": "el-prefix-un",
      "canonicalForm": "un-",
      "kind": "prefix",
      "originLanguage": "Old English",
      "bound": true,
      "allomorphs": [
        {
          "form": "un-",
          "conditionKo": "일반적인 형태"
        }
      ],
      "senses": [
        {
          "id": "els-un-negation",
          "glossKo": [
            "아닌",
            "반대의"
          ],
          "glossEn": [
            "not",
            "opposite of"
          ],
          "concepts": [
            "concept-negation"
          ],
          "function": "derivational",
          "categoryChange": null,
          "productivity": "high",
          "usageNoteKo": "형용사나 명사 앞에서 부정 또는 반대 의미를 만든다.",
          "etymologyNoteKo": "고대 영어 계열의 부정 접두사이다.",
          "sources": [
            "src-wiktionary",
            "src-editorial"
          ]
        }
      ],
      "status": "reviewed"
    },
    {
      "id": "el-prefix-in",
      "canonicalForm": "in-",
      "kind": "prefix",
      "originLanguage": "Latin",
      "bound": true,
      "allomorphs": [
        {
          "form": "in-",
          "conditionKo": "기본형"
        },
        {
          "form": "im-",
          "conditionKo": "주로 b, m, p 앞"
        },
        {
          "form": "il-",
          "conditionKo": "주로 l 앞"
        },
        {
          "form": "ir-",
          "conditionKo": "주로 r 앞"
        }
      ],
      "senses": [
        {
          "id": "els-in-negation",
          "glossKo": [
            "아닌",
            "부정의"
          ],
          "glossEn": [
            "not",
            "opposite of"
          ],
          "concepts": [
            "concept-negation"
          ],
          "function": "derivational",
          "categoryChange": null,
          "productivity": "medium",
          "usageNoteKo": "형용사 앞에서 부정 의미를 만든다.",
          "etymologyNoteKo": "라틴어 부정 접두사 계열이다.",
          "sources": [
            "src-wiktionary",
            "src-editorial"
          ]
        },
        {
          "id": "els-in-inward",
          "glossKo": [
            "안으로",
            "안에"
          ],
          "glossEn": [
            "in",
            "into",
            "toward"
          ],
          "concepts": [
            "concept-inside"
          ],
          "function": "derivational",
          "categoryChange": null,
          "productivity": "historical",
          "usageNoteKo": "방향이나 위치가 내부를 향함을 나타낸다.",
          "etymologyNoteKo": "라틴어 in에서 유래한 방향 접두사이다.",
          "sources": [
            "src-wiktionary",
            "src-editorial"
          ]
        }
      ],
      "status": "reviewed"
    },
    {
      "id": "el-prefix-trans",
      "canonicalForm": "trans-",
      "kind": "prefix",
      "originLanguage": "Latin",
      "bound": true,
      "allomorphs": [
        {
          "form": "trans-",
          "conditionKo": "기본형"
        }
      ],
      "senses": [
        {
          "id": "els-trans-across",
          "glossKo": [
            "가로질러",
            "건너편으로"
          ],
          "glossEn": [
            "across",
            "through",
            "beyond"
          ],
          "concepts": [
            "concept-crossing"
          ],
          "function": "derivational",
          "categoryChange": null,
          "productivity": "medium",
          "usageNoteKo": "경계나 공간을 가로지르는 의미를 더한다.",
          "etymologyNoteKo": "라틴어 trans에서 유래했다.",
          "sources": [
            "src-wiktionary",
            "src-editorial"
          ]
        }
      ],
      "status": "reviewed"
    },
    {
      "id": "el-prefix-re",
      "canonicalForm": "re-",
      "kind": "prefix",
      "originLanguage": "Latin",
      "bound": true,
      "allomorphs": [
        {
          "form": "re-",
          "conditionKo": "기본형"
        }
      ],
      "senses": [
        {
          "id": "els-re-again",
          "glossKo": [
            "다시",
            "되돌려"
          ],
          "glossEn": [
            "again",
            "back"
          ],
          "concepts": [
            "concept-again"
          ],
          "function": "derivational",
          "categoryChange": null,
          "productivity": "high",
          "usageNoteKo": "동작의 반복이나 되돌림을 나타낸다.",
          "etymologyNoteKo": "라틴어 re에서 유래했다.",
          "sources": [
            "src-wiktionary",
            "src-editorial"
          ]
        }
      ],
      "status": "reviewed"
    },
    {
      "id": "el-prefix-pre",
      "canonicalForm": "pre-",
      "kind": "prefix",
      "originLanguage": "Latin",
      "bound": true,
      "allomorphs": [
        {
          "form": "pre-",
          "conditionKo": "기본형"
        }
      ],
      "senses": [
        {
          "id": "els-pre-before",
          "glossKo": [
            "이전에",
            "미리"
          ],
          "glossEn": [
            "before",
            "in advance"
          ],
          "concepts": [
            "concept-before"
          ],
          "function": "derivational",
          "categoryChange": null,
          "productivity": "high",